,id,example,positive,label
267,ss267,"Not only do these wonderful people create food to come back for again and again , but the price is right ! ",1,price
268,ss268,He cares about his clients and is always available when we need him . ,0,service
269,ss269,I asked the waitress to explain the wine flight and what wines they were and she did n't know ,0,service
270,ss270,Service generally was slow and unknowledgeable . ,0,service
271,ss271,The chicken biscuit with the pepper jam is a must have . ,0,products
272,ss272,The food came out quickly and was hot and fresh ,0,service
273,ss273,Wendy I must say was the most professional and courteous food service professional we have had the pleasure of meeting . ,0,service
274,ss274,I have strict dietary needs and a manager was so helpful at looking up the info for me . ,0,service
275,ss275,Expensive and really not that great . ,1,price
276,ss276,"The doctor does not seem to be very knowledgeable , their treatment did not work . ",0,service
277,ss277,Staff member helped him and gave us other suggestions as well . ,0,service
278,ss278,waited 13 minutes for someone to pick up the phone and finally gave up ,0,service
279,ss279,The chairs are super comfortable and the prices are reasonable . ,1,price
280,ss280,I came on my lunch break and I was impressed with fast friendly service ,0,service
281,ss281,"Like , say , 2 lobsters for $ 26 cooked all plump and tender and smothered in the most divine garlic , ginger and green onion sauce that will have you licking your fingers , licking your chin and licking your partner 's face because it 's so damn delicious . ",1,price
282,ss282,"Everything is a little pricey but the ingredients are great quality , so it 's worth it ",1,price
283,ss283,She makes sure she gets that you are satisfied whilst going above & beyond ! ,0,service
284,ss284,Both will give you courteous reminder calls about your account ,0,service
285,ss285,"They always have cheap movies - lots of recent run films , but some older stuff too . ",1,price
286,ss286,"They offer a variety of leagues and training options with some discounts ( about 10 % ) for UBC students , staff , faculty and UNA residents . ",1,price
287,ss287,Nicole and Alison at the front were extremely welcoming when I arrived and made me feel very comfortable . ,0,service
288,ss288,I then had my consultation with Dr. Kruy directly .... and it was FREE ! ,1,price
289,ss289,Other places I had called wanted close to $ 500 before I even met the Dr ,1,price
290,ss290,"The staff really was engaging , and helped me , a novice , choose paints , brushes , talked with me about techniques , and told me where to go for more information ",0,service
291,ss291,"I ca n't give more than 4 stars though , because the prices were just too high for what you get . ",1,price
292,ss292,"They have a pretty decent selection of macarons as well , not as wide as Le Macaron , but definitely cheaper and just as good . ",0,products
293,ss293,There was a French lady in that day and she really knew her stuff . She was so friendly and full of smiles . ,0,service
294,ss294,Prices are high the bud is not the best . ,1,price
295,ss295,"My only prior complaint was the cramped space , but since the recent expansion , this is no longer an issue . ",0,environment
296,ss296,I do n't care about paying money for my sushi but this was not worth the price ,1,price
297,ss297,The waitress we had did n't ask if we would like another drink before brining us our check . ,0,service
298,ss298,The dudes working were very helpful and nice . ,0,service
299,ss299,"The rice "" bun "" will definitely fall apart on you . ",0,products
